{"apiVersion":"harness.planeon.ai/pack-contracts-lock/v1alpha1","catalogDigest":"sha256:26d442c4e90a19d767d32e80ef9df3d154b3146d3238dc0eecf29ee773913a26","commit":"2146278a95344cd2a8e22596b2f315b46edffc88","kind":"PackContractsLock","releaseManifestSha256":"c5dd4c39d1c69d07f8d8de3d1a09584bb906172fee2d5ac20ad25ff344b0db79","repository":"caglarsubas/mas-harness-contracts","schemas":[{"path":"schemas/v1alpha1/guidance/common.schema.json","sha256":"4d77297073d4c2e559f1131fbada566b499197f87113f7e28b136f0b4ae5f429"},{"path":"schemas/v1alpha1/guidance/data-readiness-assessment.schema.json","sha256":"ffe003a1a7ec0773f49d8f394ac3dd6281114bd4335ff05c87d223412faf92a5"},{"path":"schemas/v1alpha1/guidance/guidance-rule.schema.json","sha256":"dafa2d970aade1c8f3113e691542d3db5e80d0d161b395daedf386beeaf36fe3"},{"path":"schemas/v1alpha1/guidance/questionnaire-definition.schema.json","sha256":"c8857968da611838f4bd623c7727cd3c90619f12fc7cfed0db96effacac47223"}]}
